{
  "app": "JuiceMount",
  "version": "0.5.0",
  "contract_version": 3,
  "instance_id": "5C7E0E2A-9B41-4E6D-8F2A-1A2B3C4D5E6F",
  "device_digest": "e09373f9fc8999d5408f33976a1b4f01",
  "volume_name": "zpool",
  "mount_point": "/Volumes/zpool",
  "nas_root": "/Volumes/zpool",
  "control_plane": "http://127.0.0.1:11050",
  "metadata_db_path": "/Users/leland/Library/Application Support/JuiceMount/metadata.db",
  "deployment": "gui",
  "wire_terms": "logger/1",
  "capabilities": [
    "activity",
    "assertions",
    "blob",
    "cache-status",
    "changes",
    "contribute",
    "contribute-derivatives",
    "derivatives",
    "derivatives-batch",
    "health",
    "lookup",
    "metadata",
    "metrics",
    "offline",
    "pin",
    "residency",
    "self-test",
    "spool",
    "unpin",
    "verify-pins",
    "whoami"
  ]
}
